{
  "id": "boho",
  "label": "Boho / Tribal",
  "family": "decorative",
  "defaultMotifSize": 65,
  "complexityLevels": ["simple", "moderate", "intricate"],
  "roles": ["hero", "secondary", "filler", "accent"],
  "rotationAllowed": true,
  "mirrorAllowed": true,
  "disableGridRhythm": false,
  "compatiblePatternGrammars": ["dense", "maximalist", "balanced"],
  "rules": []
}
