{
  "id": "seasonal",
  "label": "Seasonal / Holiday",
  "family": "icon",
  "defaultMotifSize": 65,
  "complexityLevels": ["simple", "moderate", "intricate"],
  "roles": ["hero", "secondary", "filler", "accent"],
  "rotationAllowed": true,
  "mirrorAllowed": true,
  "disableGridRhythm": false,
  "compatiblePatternGrammars": ["balanced", "dense"],
  "rules": []
}
