{
  "id": "animalprint",
  "label": "Animal Print",
  "family": "background",
  "defaultMotifSize": 75,
  "complexityLevels": ["simple", "moderate", "intricate"],
  "roles": ["hero", "secondary", "filler", "accent"],
  "rotationAllowed": true,
  "mirrorAllowed": true,
  "disableGridRhythm": false,
  "compatiblePatternGrammars": ["dense", "maximalist"],
  "rules": []
}
