{
  "id": "tropical",
  "label": "Tropical",
  "family": "leaf",
  "defaultMotifSize": 75,
  "complexityLevels": ["simple", "moderate", "intricate"],
  "roles": ["hero", "secondary", "filler", "accent"],
  "rotationAllowed": true,
  "mirrorAllowed": true,
  "disableGridRhythm": false,
  "compatiblePatternGrammars": ["editorial", "maximalist", "dense"],
  "rules": []
}
